{
  "id": "c06a1234-5678-4abc-9def-445566778899",
  "name": "Cours 06 - 汉字",
  "description": "Caractères du cours 6 - Écriture et objets du quotidien",
  "category": "community",
  "version": "1.1",
  "author": "Cours de Chinois",
  "createdDate": "2025-11-26T10:30:00Z",
  "characters": [
    {
      "id": "c0600000-0000-0000-0000-000000000001",
      "simplified": "文",
      "traditional": "文",
      "pinyin": "wén",
      "meaning": ["écriture", "texte", "culture"],
      "frequency": 42,
      "hskLevel": 1,
      "examples": ["中文 (zhōngwén) - chinois (langue)", "文化 (wénhuà) - culture", "文字 (wénzì) - écriture"],
      "mnemonics": "Traits croisés représentant l'écriture",
      "listeningSentences": [
        "我学中文。",
        "中国文化很丰富。",
        "这篇文章很好。",
        "我喜欢中文。",
        "文字很重要。"
      ]
    },
    {
      "id": "c0600000-0000-0000-0000-000000000002",
      "simplified": "这",
      "traditional": "這",
      "pinyin": "zhè",
      "meaning": ["ceci", "ce", "cette"],
      "frequency": 15,
      "hskLevel": 1,
      "examples": ["这个 (zhège) - celui-ci", "这里 (zhèlǐ) - ici", "这是... (zhè shì...) - c'est..."],
      "mnemonics": "Démonstratif pour pointer vers quelque chose proche",
      "listeningSentences": [
        "这是我的书。",
        "这个很好吃。",
        "这里很漂亮。",
        "这是什么？",
        "我喜欢这个。"
      ]
    },
    {
      "id": "c0600000-0000-0000-0000-000000000003",
      "simplified": "自",
      "traditional": "自",
      "pinyin": "zì",
      "meaning": ["soi-même", "de", "depuis"],
      "frequency": 26,
      "hskLevel": 2,
      "examples": ["自己 (zìjǐ) - soi-même", "自然 (zìrán) - naturel", "来自 (láizì) - venir de"],
      "mnemonics": "Nez pointé vers soi = soi-même",
      "listeningSentences": [
        "我自己做的。",
        "他来自北京。",
        "很自然。",
        "自己的事情自己做。",
        "这个很自然。"
      ]
    },
    {
      "id": "c0600000-0000-0000-0000-000000000004",
      "simplified": "首",
      "traditional": "首",
      "pinyin": "shǒu",
      "meaning": ["tête", "chef", "premier", "classificateur pour chanson/poème"],
      "frequency": 68,
      "hskLevel": 3,
      "examples": ["首都 (shǒudū) - capitale", "一首歌 (yī shǒu gē) - une chanson"],
      "mnemonics": "Tête avec cheveux = chef/premier",
      "listeningSentences": [
        "北京是中国的首都。",
        "我会唱一首歌。",
        "这首歌很好听。",
        "首先要学习。",
        "这是首要任务。"
      ]
    },
    {
      "id": "c0600000-0000-0000-0000-000000000005",
      "simplified": "道",
      "traditional": "道",
      "pinyin": "dào",
      "meaning": ["voie", "chemin", "dire"],
      "frequency": 44,
      "hskLevel": 2,
      "examples": ["知道 (zhīdào) - savoir", "道路 (dàolù) - route"],
      "mnemonics": "Tête (首) qui marche = voie/chemin",
      "listeningSentences": [
        "我知道了。",
        "你知道吗？",
        "这条道路很长。",
        "我不知道。",
        "知道了，谢谢。"
      ]
    },
    {
      "id": "c0600000-0000-0000-0000-000000000006",
      "simplified": "贝",
      "traditional": "貝",
      "pinyin": "bèi",
      "meaning": ["coquillage", "coquille", "monnaie"],
      "frequency": 90,
      "hskLevel": 3,
      "examples": ["贝壳 (bèiké) - coquillage"],
      "mnemonics": "Forme de coquillage (ancien signe de richesse)",
      "listeningSentences": [
        "海边有很多贝壳。",
        "这个贝壳很漂亮。",
        "我喜欢收集贝壳。",
        "贝壳的颜色很好看。"
      ]
    },
    {
      "id": "c0600000-0000-0000-0000-000000000007",
      "simplified": "贵",
      "traditional": "貴",
      "pinyin": "guì",
      "meaning": ["précieux", "cher", "noble"],
      "frequency": 52,
      "hskLevel": 2,
      "examples": ["贵 (tài guì) - trop cher", "贵姓 (guìxìng) - votre nom (poli)"],
      "mnemonics": "Coquillage (贝) = précieux car ancien symbole de richesse",
      "listeningSentences": [
        "太贵了！",
        "这个很贵。",
        "您贵姓？",
        "不贵，很便宜。",
        "这里的东西很贵。"
      ]
    },
    {
      "id": "c0600000-0000-0000-0000-000000000008",
      "simplified": "手",
      "traditional": "手",
      "pinyin": "shǒu",
      "meaning": ["main"],
      "frequency": 34,
      "hskLevel": 1,
      "examples": ["手机 (shǒujī) - téléphone portable", "右手 (yòushǒu) - main droite", "左手 (zuǒshǒu) - main gauche"],
      "mnemonics": "Dessin d'une main avec les doigts",
      "listeningSentences": [
        "我的手机在哪儿？",
        "用右手写字。",
        "洗手吧。",
        "牵手走。",
        "我的手很冷。"
      ]
    },
    {
      "id": "c0600000-0000-0000-0000-000000000009",
      "simplified": "看",
      "traditional": "看",
      "pinyin": "kàn",
      "meaning": ["regarder", "voir", "lire"],
      "frequency": 24,
      "hskLevel": 1,
      "examples": ["看书 (kànshū) - lire un livre", "看见 (kànjiàn) - voir", "看电视 (kàn diànshì) - regarder la télé"],
      "mnemonics": "Main (手) au-dessus d'œil (目) = regarder",
      "listeningSentences": [
        "我在看书。",
        "看电视吧。",
        "我看见他了。",
        "看一看。",
        "看这里！"
      ]
    },
    {
      "id": "c0600000-0000-0000-0000-000000000010",
      "simplified": "那",
      "traditional": "那",
      "pinyin": "nà",
      "meaning": ["cela", "ce", "cette"],
      "frequency": 19,
      "hskLevel": 1,
      "examples": ["那个 (nàge) - celui-là", "那里 (nàlǐ) - là-bas", "那是... (nà shì...) - c'est..."],
      "mnemonics": "Démonstratif pour pointer vers quelque chose éloigné",
      "listeningSentences": [
        "那是什么？",
        "那个很好。",
        "那里很远。",
        "我要那个。",
        "那边有人吗？"
      ]
    }
  ]
}
